{
  "action": "decompose",
  "evidence": {
    "date": "2026-08-12",
    "litert_version": "2.1.3 (guide device findings; the upstream skill is unversioned)",
    "source_model": "litert-samples skills/gpu-clean-conversion/SKILL.md symptom table, row 'SELECT / SELECT_V2': 'Replace with arithmetic: x*(1-m) + v*m'; corroborated by ~/Downloads/depthanything-android/docs/LITERT_CONVERSION_GUIDE.md (wav2vec2: mask lowering emits SELECT_V2 + BROADCAST_TO; DeepPhonemizer: 'eq/SELECT_V2/CAST ... only the GPU delegate bans them')"
  },
  "expected_effect": "the SELECT_V2 node is replaced by CAST+SUB+MUL+ADD; the SUB/MUL/ADD masking arithmetic delegates, so delegated coverage improves and the partition break at SELECT_V2 is removed (the bool->float32 boundary CAST may itself stay off the GPU; coverage still improves)",
  "fixture": {
    "matrix": "fixtures/matrix_gpu_select_fixture.json",
    "model": "fixtures/model_select_v2_fixture.tflite"
  },
  "id": "select-v2-to-arithmetic",
  "match": {
    "dtypes": [
      "float32"
    ],
    "op": "SELECT_V2"
  },
  "notes": "Promoted 2026-08-19 (owner approved the recommended disposition). Validated only on the synthetic staging fixture, not re-verified on a real backend. Semantics: out = else + (then - else) * cast(cond) == SELECT_V2(cond, then, else) for finite inputs; the mask is exactly 0.0 or 1.0, so lanes where cond is false are bit-exact and lanes where cond is true are within 1 ulp of float32 (else + (then - else) reassociation; fixture-measured max_abs_diff 3.0e-08, inside the default 1e-5 tolerance). SELECT_V2's operand broadcasting carries over because SUB/MUL/ADD broadcast the same way (intermediates borrow like:out:0). NOT equivalent when the unselected branch holds non-finite values (inf/NaN propagate through the arithmetic form, e.g. masked -inf attention biases) — SELECT_V2 discards them. Possible attach point after approval: the SELECT_V2 fallback entry in data/matrix/gpu_metal_mac__0.15.0.json currently has no rewrite_hints; whether this arithmetic rewrite applies there is for the owner to decide (see OPEN-QUESTIONS.md).",
  "params": {
    "intermediates": [
      {
        "dtype": "float32",
        "name": "mask_f",
        "shape": "like:in:0"
      },
      {
        "dtype": "like:out:0",
        "name": "diff",
        "shape": "like:out:0"
      },
      {
        "dtype": "like:out:0",
        "name": "scaled",
        "shape": "like:out:0"
      }
    ],
    "nodes": [
      {
        "inputs": [
          "in:0"
        ],
        "op": "CAST",
        "outputs": [
          "tmp:mask_f"
        ]
      },
      {
        "inputs": [
          "in:1",
          "in:2"
        ],
        "op": "SUB",
        "outputs": [
          "tmp:diff"
        ]
      },
      {
        "inputs": [
          "tmp:diff",
          "tmp:mask_f"
        ],
        "op": "MUL",
        "outputs": [
          "tmp:scaled"
        ]
      },
      {
        "inputs": [
          "in:2",
          "tmp:scaled"
        ],
        "op": "ADD",
        "outputs": [
          "out:0"
        ]
      }
    ]
  },
  "provenance": "inferred",
  "schema_version": "1.0",
  "title": "DRAFT: Decompose SELECT_V2 into mask arithmetic (cast + sub + mul + add)"
}